{
  "schema": 1,
  "backend": "gbastudio_engine",
  "kind": "platformer",
  "build": {
    "target": "exported_platformer",
    "make_target": "all"
  },
  "entry": "main.cpp",
  "project_data": "platformer_project_data.hpp",
  "generated_assets": [],
  "requires": {
    "engine_pack": ">=1.7.0",
    "features": [
      "platformer_runtime",
      "engine_sdk.platformer_project_data_contract",
      "platformer_runtime.platformer_basic_template",
      "platformer_runtime.hazard_regions",
      "platformer_runtime.checkpoint_respawn",
      "platformer_runtime.platformer_camera_zones",
      "platformer_runtime.slope_floor_snap",
      "platformer_runtime.actor_animation_state",
      "platformer_runtime.enemy_stomp_contact",
      "platformer_runtime.enemy_tile_patrol",
      "platformer_runtime.moving_platform_landing_snap",
      "audio.runtime_bus_volume",
      "audio.runtime_bus_fade",
      "audio.runtime_bus_mute_all_profiles",
      "audio.pcm_sfx_event_options",
      "save.universal_runtime_envelope",
      "save.export_project_config"
    ]
  }
}
